{
  "$schema": "https://raw.githubusercontent.com/HaileyStorm/Creative-Writing-Rubrics/main/schema/hbq_diagnostic_report.schema.json",
  "artifact_id": "gray-blood-new-chapter-01",
  "available_question_count": 228,
  "bundle_id": "prose.chapter",
  "note": "No composite score is produced for a selected-question subset; local subset results must not be averaged.",
  "report_kind": "selected-question-diagnostic",
  "selected_question_count": 28,
  "selected_question_ids": [
    "craft.narrative.characterization.behavior",
    "craft.narrative.characterization.motives",
    "craft.narrative.characterization.contradiction",
    "craft.narrative.character_arc.local_contribution",
    "craft.narrative.plot_and_causality.causal_chain",
    "craft.narrative.plot_and_causality.consequence",
    "craft.narrative.narrative_momentum.curiosity",
    "craft.narrative.narrative_momentum.progress",
    "craft.narrative.opening.entry",
    "craft.narrative.opening.tone",
    "craft.narrative.ending_and_closure.changed_state",
    "craft.narrative.ending_and_closure.resonance",
    "craft.narrative.worldbuilding.rules",
    "craft.narrative.worldbuilding.constraints",
    "craft.narrative.worldbuilding.integration",
    "craft.narrative.continuity_and_canon_integrity.characters",
    "craft.narrative.continuity_and_canon_integrity.world",
    "craft.narrative.temporal_and_spatial_continuity.state_update",
    "craft.narrative.pacing_and_narrative_time.allocation",
    "craft.narrative.pacing_and_narrative_time.no_stall",
    "craft.narrative.exposition_and_information_management.timing",
    "craft.narrative.exposition_and_information_management.embedding",
    "core.language_craft.no_awkwardness",
    "core.voice_and_stylistic_identity.ownership",
    "craft.narrative.dialogue.subtext",
    "core.emotional_and_intellectual_effect.earned_emotion",
    "core.freshness_and_non_genericness.unpredictable_specificity",
    "core.economy_and_relevance.no_restatement"
  ],
  "status": "DIAGNOSTIC_SUBSET",
  "task_contract": null,
  "verdict_counts": {
    "CANNOT_ASSESS": 2,
    "NO": 6,
    "NOT_APPLICABLE": 0,
    "YES": 20
  }
}
